{
  "$id": "https://hawkinsoperations.example/schemas/multi-artifact-review-index-v1.schema.json",
  "$schema": "https://json-schema.org/draft/2020-12/schema",
  "title": "Hoxline Multi-Artifact Review Index v1",
  "type": "object",
  "additionalProperties": false,
  "required": [
    "index_version",
    "index_id",
    "description",
    "artifacts",
    "expected_pass_artifacts",
    "expected_blocked_artifacts",
    "batch_claim_boundary",
    "public_safe_status",
    "human_review_required",
    "ai_disposition_authority",
    "runtime_boundary",
    "signal_boundary",
    "proof_boundary",
    "generated_outputs",
    "next_gate"
  ],
  "properties": {
    "index_version": { "const": "multi-artifact-review-index-v1" },
    "index_id": { "type": "string", "minLength": 1 },
    "description": { "type": "string", "minLength": 1 },
    "artifacts": {
      "type": "array",
      "minItems": 1,
      "items": {
        "type": "object",
        "additionalProperties": false,
        "required": ["artifact_id", "manifest_path"],
        "properties": {
          "artifact_id": {
            "type": "string",
            "pattern": "^(?:HO-DET|HO-NDR|ID-DET|AWS-DET)-[0-9]{3}$"
          },
          "manifest_path": {
            "type": "string",
            "pattern": "^examples/review/[a-z0-9-]+-artifact-manifest-v1[.]json$"
          }
        }
      }
    },
    "expected_pass_artifacts": {
      "type": "array",
      "uniqueItems": true,
      "items": { "type": "string" }
    },
    "expected_blocked_artifacts": {
      "type": "array",
      "uniqueItems": true,
      "items": { "type": "string" }
    },
    "batch_claim_boundary": { "type": "string", "minLength": 1 },
    "public_safe_status": { "const": "NOT_PUBLIC_SAFE" },
    "human_review_required": { "const": true },
    "ai_disposition_authority": { "const": false },
    "runtime_boundary": { "type": "string", "minLength": 1 },
    "signal_boundary": { "type": "string", "minLength": 1 },
    "proof_boundary": { "type": "string", "minLength": 1 },
    "generated_outputs": {
      "const": [
        "batch-machine-state.json",
        "batch-summary.md",
        "batch-reviewer-pack.md",
        "batch-run-summary.json"
      ]
    },
    "next_gate": { "type": "string", "minLength": 1 }
  }
}
