{
  "ai_disposition_authority": false,
  "artifacts": [
    {
      "artifact_id": "HO-DET-009",
      "manifest_path": "examples/review/ho-det-009-artifact-manifest-v1.json"
    },
    {
      "artifact_id": "HO-DET-010",
      "manifest_path": "examples/review/ho-det-010-artifact-manifest-v1.json"
    },
    {
      "artifact_id": "HO-DET-011",
      "manifest_path": "examples/review/ho-det-011-artifact-manifest-v1.json"
    },
    {
      "artifact_id": "HO-DET-012",
      "manifest_path": "examples/review/ho-det-012-artifact-manifest-v1.json"
    },
    {
      "artifact_id": "HO-DET-013",
      "manifest_path": "examples/review/ho-det-013-artifact-manifest-v1.json"
    },
    {
      "artifact_id": "AWS-DET-001",
      "manifest_path": "examples/review/aws-det-001-artifact-manifest-v1.json"
    },
    {
      "artifact_id": "ID-DET-001",
      "manifest_path": "examples/review/id-det-001-artifact-manifest-v1.json"
    },
    {
      "artifact_id": "ID-DET-002",
      "manifest_path": "examples/review/id-det-002-artifact-manifest-v1.json"
    },
    {
      "artifact_id": "ID-DET-003",
      "manifest_path": "examples/review/id-det-003-artifact-manifest-v1.json"
    },
    {
      "artifact_id": "ID-DET-004",
      "manifest_path": "examples/review/id-det-004-artifact-manifest-v1.json"
    },
    {
      "artifact_id": "HO-NDR-001",
      "manifest_path": "examples/review/ho-ndr-001-artifact-manifest-v1.json"
    }
  ],
  "batch_claim_boundary": "Local fixture review set only; not runtime proof and not proof authority.",
  "description": "Governed local cross-domain fixture review set with an explicit boundary-contract BLOCKED outcome for HO-NDR-001.",
  "expected_blocked_artifacts": [
    "HO-NDR-001"
  ],
  "expected_pass_artifacts": [
    "HO-DET-009",
    "HO-DET-010",
    "HO-DET-011",
    "HO-DET-012",
    "HO-DET-013",
    "AWS-DET-001",
    "ID-DET-001",
    "ID-DET-002",
    "ID-DET-003",
    "ID-DET-004"
  ],
  "generated_outputs": [
    "batch-machine-state.json",
    "batch-summary.md",
    "batch-reviewer-pack.md",
    "batch-run-summary.json"
  ],
  "human_review_required": true,
  "index_id": "hoxline-multi-artifact-review-index-v1",
  "index_version": "multi-artifact-review-index-v1",
  "next_gate": "human_review_gate",
  "proof_boundary": "Batch output is local reviewer evidence of engine behavior only; it is not public proof.",
  "public_safe_status": "NOT_PUBLIC_SAFE",
  "runtime_boundary": "No runtime execution, endpoint mutation, VM, Wazuh, Splunk, Cribl, private infrastructure, or live signal action.",
  "signal_boundary": "Synthetic fixture signals only; not public signal observation."
}
